### ISSUE TITLE
Bring more of MIT OL's products under celery monitoring

### ISSUE THREAD

**Issue by feoh** [mitodl/ol-infrastructure#2290]
### Description/Context
Add:
- [x] MIT Open config
- [x] MIT Open UI
- [x] MITx Online Heroku config
- [x] MITx Online Heroku UI
- [x] xPRO Heroku config
- [x] xPRO Heroku UI
- [x] Bootcamps(?) config
- [x] Bootcamps(?) UI
- [x] ODL Video config
- [x] ODL Video UI
- [x] Open Discussions config
- [x] Open Discussions UI
- [x] OCW Studio config
- [x] OCW Studio UI
- [x] Superset config
- [x] Superset UI

to celery monitoring so we can track task status and completion better in those applications.

### Plan/Design

We'll need to add the redis connection info and redis token as outputs from these projects and inputs to the celery-monitiring project in Pulumi.

**Comment by feoh** [comment]
We need to add the task_track_started and task_send_sent_event configurables to our celery clients for all our Heroku based applications, but we're starting with mit-open and mit-xpro.

[Here's](https://github.com/mitodl/ol-infrastructure/pull/2271 ) the change that we made for our edx platform apps.

**Comment by feoh** [comment]
All other projects are in celery monitoring showing workers.

The only one that remains is superset.

**Comment by feoh** [comment]
I'm calling Superset good with the proviso that @blarghmatey should examine things on his return from vacation if he's willing.

From the celery monitoring web node I did a packet capture and show traffic going back and forth to Superset redis, so the agent is properly seeded and we have connectivity but for some reason there are no workers or tasks showing.

Is it possible that superset HAS no workers or tasks?

Here's the packet capture:

```
admin@ip-10-0-0-94:~$ sudo tshark host 10.3.2.198
Running as user "root" and group "root". This could be dangerous.
Capturing on 'ens5'
 ** (tshark:3348) 20:28:09.127666 [Main MESSAGE] -- Capture started.
 ** (tshark:3348) 20:28:09.127742 [Main MESSAGE] -- File: "/tmp/wireshark_ens54FQRM2.pcapng"
    1 0.000000000    10.0.0.94 → 10.3.2.198   TCP 66 59394 → 6379 [FIN, ACK] Seq=1 Ack=1 Win=501 Len=0 TSval=4011788213 TSecr=2768967405
    2 0.000051551    10.0.0.94 → 10.3.2.198   TCP 66 59384 → 6379 [FIN, ACK] Seq=1 Ack=1 Win=501 Len=0 TSval=4011788214 TSecr=2768967409
    3 0.000495079   10.3.2.198 → 10.0.0.94    TCP 66 6379 → 59394 [FIN, ACK] Seq=1 Ack=2 Win=227 Len=0 TSval=2770045389 TSecr=4011788213
    4 0.000531559   10.3.2.198 → 10.0.0.94    TCP 66 6379 → 59384 [FIN, ACK] Seq=1 Ack=2 Win=219 Len=0 TSval=2770045389 TSecr=4011788214
    5 0.000555390    10.0.0.94 → 10.3.2.198   TCP 66 59394 → 6379 [ACK] Seq=2 Ack=2 Win=501 Len=0 TSval=4011788214 TSecr=2770045389
    6 0.000555380    10.0.0.94 → 10.3.2.198   TCP 66 59384 → 6379 [ACK] Seq=2 Ack=2 Win=501 Len=0 TSval=4011788214 TSecr=2770045389
    7 0.034508422    10.0.0.94 → 10.3.2.198   TCP 66 40396 → 6379 [FIN, ACK] Seq=1 Ack=1 Win=501 Len=0 TSval=4011788248 TSecr=2768961736
    8 0.034965950   10.3.2.198 → 10.0.0.94    TCP 66 6379 → 40396 [FIN, ACK] Seq=1 Ack=2 Win=219 Len=0 TSval=2770045423 TSecr=4011788248
    9 0.035002681    10.0.0.94 → 10.3.2.198   TCP 66 40396 → 6379 [ACK] Seq=2 Ack=2 Win=501 Len=0 TSval=4011788248 TSecr=2770045423
```
